{"version":"1.0.0","id":"test.portable-light","format":"wotex-home.portable-profile.v1","provenance":{"source":"Independent fixture","publisher":"Fixture author","license":"Test data"},"dependencies":[{"sha256":"09f6b87367ea3a974cd4be9e7a562db73e1776d012854fb487b00ac9be520360","kind":"registry"}],"binding":"lifx-direct-power-v1","fingerprint":{"model":"lifx.product.22","manufacturer":"lifx.vendor.1","firmware_versions":["1.22"],"transport":"udp"}}
